<?xml version="1.0" encoding="UTF-8"?>
<ns0:library xmlns:ns0="http://lang.whole.org/Pojo" xmlns:xsi="http://www.w3.org/2001/XMLSchema-instance" xsi:schemaLocation="http://lang.whole.org/Pojo Pojo.xsd">
    <ns0:name>DefinedAnnotations</ns0:name>
    <ns0:languageURI>http://lang.whole.org/DefinedAnnotations</ns0:languageURI>
    <ns0:declarations>
        <ns0:annotationDeclaration>
            <ns0:name>Deprecated</ns0:name>
            <ns0:properties/>
        </ns0:annotationDeclaration>
        <ns0:annotationDeclaration>
            <ns0:name>Documented</ns0:name>
            <ns0:properties/>
        </ns0:annotationDeclaration>
        <ns0:annotationDeclaration>
            <ns0:name>SuppressWarnings</ns0:name>
            <ns0:properties/>
        </ns0:annotationDeclaration>
        <ns0:annotationDeclaration>
            <ns0:name>Target</ns0:name>
            <ns0:properties>
                <ns0:property>
                    <ns0:referenceType>ElementType</ns0:referenceType>
                    <ns0:name>value</ns0:name>
                </ns0:property>
            </ns0:properties>
        </ns0:annotationDeclaration>
        <ns0:enumDeclaration>
            <ns0:name>ElementType</ns0:name>
            <ns0:values>
                <ns0:name>enum</ns0:name>
                <ns0:name>pojo</ns0:name>
                <ns0:name>property</ns0:name>
            </ns0:values>
        </ns0:enumDeclaration>
        <ns0:annotationDeclaration>
            <ns0:name>Retention</ns0:name>
            <ns0:properties>
                <ns0:property>
                    <ns0:referenceType>RetentionPolicy</ns0:referenceType>
                    <ns0:name>value</ns0:name>
                </ns0:property>
            </ns0:properties>
        </ns0:annotationDeclaration>
        <ns0:enumDeclaration>
            <ns0:name>RetentionPolicy</ns0:name>
            <ns0:values>
                <ns0:name>source</ns0:name>
                <ns0:name>class</ns0:name>
                <ns0:name>runtime</ns0:name>
            </ns0:values>
        </ns0:enumDeclaration>
        <ns0:annotationDeclaration>
            <ns0:name>Abstract</ns0:name>
            <ns0:properties/>
        </ns0:annotationDeclaration>
        <ns0:annotationDeclaration>
            <ns0:name>Derived</ns0:name>
            <ns0:properties/>
        </ns0:annotationDeclaration>
        <ns0:annotationDeclaration>
            <ns0:name>Final</ns0:name>
            <ns0:properties/>
        </ns0:annotationDeclaration>
        <ns0:annotationDeclaration>
            <ns0:name>Id</ns0:name>
            <ns0:properties/>
        </ns0:annotationDeclaration>
        <ns0:annotationDeclaration>
            <ns0:name>Optional</ns0:name>
            <ns0:properties/>
        </ns0:annotationDeclaration>
        <ns0:annotationDeclaration>
            <ns0:name>Reference</ns0:name>
            <ns0:properties/>
        </ns0:annotationDeclaration>
        <ns0:annotationDeclaration>
            <ns0:name>Shared</ns0:name>
            <ns0:properties/>
        </ns0:annotationDeclaration>
        <ns0:annotationDeclaration>
            <ns0:name>Transient</ns0:name>
            <ns0:properties/>
        </ns0:annotationDeclaration>
        <ns0:annotationDeclaration>
            <ns0:name>TypeRelations</ns0:name>
            <ns0:properties>
                <ns0:property>
                    <ns0:arrayType>
                        <ns0:referenceType>Name</ns0:referenceType>
                    </ns0:arrayType>
                    <ns0:name>types</ns0:name>
                </ns0:property>
            </ns0:properties>
        </ns0:annotationDeclaration>
        <ns0:annotationDeclaration>
            <ns0:name>JavaDoc</ns0:name>
            <ns0:properties>
                <ns0:property>
                    <ns0:primitiveType>String</ns0:primitiveType>
                    <ns0:name>description</ns0:name>
                </ns0:property>
                <ns0:property>
                    <ns0:primitiveType>String</ns0:primitiveType>
                    <ns0:name>license</ns0:name>
                </ns0:property>
                <ns0:property>
                    <ns0:primitiveType>String</ns0:primitiveType>
                    <ns0:name>author</ns0:name>
                </ns0:property>
            </ns0:properties>
        </ns0:annotationDeclaration>
    </ns0:declarations>
</ns0:library>
